{
  "trace_version": 1,
  "agent": "email-lead-to-crm",
  "run_id": "2026-07-04T09-15-abc123",
  "span_id": "s-4",
  "parent_span_id": "s-2",
  "name": "Read the lead's mailbox",
  "kind": "broker",
  "started_at": "2026-07-04T09:15:12Z",
  "ended_at": "2026-07-04T09:15:14Z",
  "status": "ok",
  "error": null,
  "attributes": {
    "operation": "gmail.search",
    "attempt": 2
  },
  "usage": {
    "tokens_in": 1420,
    "tokens_out": 310,
    "cost_usd": 0.0041,
    "source": "reported"
  }
}
